{
  "$schema": "../schema/model/config/Config.schema.json",
  "productsList": {
    "url": "config/productsCatalog.json"
  },
  "defaultProductId": "11",
  "fonts": {
    "url": "config/fontsList.json"
  },
  "colors": {
    "url": "config/colorsList.json"
  },
  "graphicsList": {
    "url": "config/graphicsCatalog.json"
  },
  "social": {
  },
  "options": {
    "fontsCSSUrl": "fonts/fonts.css",
    "checkeredBackground": true,
    "unit": "in",
    "unit2": "ft",
    "unitConversionMult": 12,
    "showProductSelector": true,
    "minDPU": 150,
    "showUploadedColorsDialog": true,
    "enableQuantity": true,
    "snapConfigs": {
      "snapToEditableArea": true,
      "snapToObjects": true,
      "snapRotation": true,
      "enableSnapGuides": true
    },
    "zoomConfigs": {
      "enabled": true,
      "min": 50,
      "max": 150,
      "step": 10
    }
  },
  "textEffects": {
    "config": "config/textEffectsList.json"
  },
  "defaultNameObjectText": "NAMES HERE",
  "defaultNumberObjectText": "00",
  "assetsUrl": "assets/",
  "galleryBaseUrl": "",
  "getQuoteUrl": "services/php/getQuote.php",
  "getDesignsUrl": "services/php/getDesigns.php?email=${email}&product_id=${product_id}",
  "saveDesignUrl": "services/php/saveDesign.php",
  "loadDesignUrl": "services/php/loadDesign.php?design_id=${design_id}",
  "redirectUrl": "services/php/order.php?info=true&design_id=${design_id}",
  "generateVisualsUrl": "services/php/generateVisuals.php?design_id=${design_id}",
  "uploadImageUrl": "services/php/uploadImage.php",
  "shareLinkUrl": "?design_id=${design_id}",
  "redirectWindow": "",
  "saveTemplateUrl": "services/php/saveTemplate.php",
  "getTemplatesUrl": "services/php/getTemplates.php?product_id=${product_id}"
}
